{
  "contractId": "retail-golden-v1",
  "schemaVersion": "retail-golden-v1",
  "inputIdentity": {
    "baselineSourceSha": "7a65da010abf0e3730731b6d744b532156c48fdc",
    "profile": "small",
    "seed": 42,
    "pythonLockSha256": "f41c727b39f99106f95b7937b2811e8d27db89d1d5106e9f1d9effd4403143d2"
  },
  "generator": {
    "fileCount": 18,
    "totalRows": 6812,
    "orderedSummarySha256": "60ce82ce297acec1e3c047466f4b068baed5dc1875964832cb6cda3d4f91e9d6",
    "manifestProjectionSha256": "74ef96503fae5b0805c3261a5930f50420e8d168f2329f15408827ac29672f25",
    "inputWindow": {"start": "2025-07-01", "end": "2026-06-30"}
  },
  "anomalies": {
    "generatorNullPromotionIds": 1,
    "generatorInvalidStatuses": 10,
    "martNullPromotionIds": 879,
    "martInvalidStatuses": 9
  },
  "dbt": {
    "modelCount": 51,
    "genericTestCount": 141,
    "sourceCount": 18,
    "configuredWarningTests": 9,
    "observedWarnings": 7,
    "build": {"pass": 179, "warn": 7, "fail": 0, "total": 186},
    "graphProjectionSha256": "9cc9079097c4891e2939085729f23d0649af4ded52518966a6c0988991d533df"
  },
  "marts": [
    {"martId":"mart_daily_revenue","rowCount":319,"contentSha256":"59bf560c8a504481f60c2e3c593f840f17afc0f38a835db0cc1ed7b6e99f7fc8"},
    {"martId":"mart_top_products","rowCount":149,"contentSha256":"5ea0c4bb2504002fa601c39635b4c71a61c444a2cb0df0a41767128ff9992167"},
    {"martId":"mart_customer_cohorts","rowCount":97,"contentSha256":"84e10b8277ecfbc30187fb45c8760b5b115cfcbf706cdb60374919cb1f8d77db"},
    {"martId":"mart_fulfillment_performance","rowCount":25,"contentSha256":"8c0114d1ab48b4fb42009aba3df192988bf917004461d0c0dd0155d0283dce60"},
    {"martId":"mart_returns_analysis","rowCount":47,"contentSha256":"2aa068d1c676cc9234f9a6703f0d2490a10b007ae673b758fa45f614963e7db4"},
    {"martId":"mart_promotion_effectiveness","rowCount":7,"contentSha256":"5b6bc790aaeed2891608b8c1fceba0d4904fd49b9865c160658d6f5249e0bfc0"},
    {"martId":"mart_channel_geography","rowCount":14,"contentSha256":"ca42f1e1d54fa8695e55689cd7d6abaf33b63f431154f01da917d7d4f5d697fb"},
    {"martId":"mart_inventory_health","rowCount":149,"contentSha256":"33cf57ccc6ce152e90ce1a19665f888e7a204150e95c3da75a053770543e9f52"},
    {"martId":"mart_web_funnel_conversion","rowCount":15,"contentSha256":"63e8aabf6b333328f7f875df5aba696cebefbd2a5c12b6112c50f14fb4e1d189"},
    {"martId":"mart_supplier_purchasing","rowCount":10,"contentSha256":"2b6c9c9fe4f0e1b8ea756d8765d25b4ed52dadb89d4e8ed1631f265b3985b95b"},
    {"martId":"mart_data_quality","rowCount":10,"contentSha256":"cd3bb0424396aad0d902e9dc594072a5506c3b6484be3f3f2209b7cbbcdae5fa"}
  ],
  "martSummarySha256": "4b8a16acd83064c374061a0f1eb4737e6b9fd6fe2fcaae3ec45a659dc684c84b",
  "legacyDiscoverySummarySha256": "8ffb3ef70bdb460eebe28ec5fb1986ec728fcd711e658523efb93671df8418ea",
  "assertions": ["exact-inputs", "exact-dbt-results", "exact-marts", "historical-context-is-not-current"],
  "integrity": {"algorithm": "sha-256", "claim": "local-corruption-detection-not-authenticity"}
}
